{
  "$schema": "https://json-schema.org/draft/2020-12/schema",
  "$id": "https://t-drive.local/schema/fcprofile.schema.json",
  "title": "T-Drive FacialController .fcprofile.json",
  "description": "命名規則プロファイル（format: FacialNamingProfile, version 1）。UE 版 UFacialNamingProfile（標準カーブ名・ミラー規則・カーブ可動域）に対応する。docs/14 §4.4。知らないキーはどの階層でも許す（読む側は無視して保持する）。必須は format / version / name だけ（欠けた欄は読む側が既定値で補う）。",
  "type": "object",
  "required": ["format", "version", "name"],
  "properties": {
    "format": { "const": "FacialNamingProfile" },
    "version": { "type": "integer", "minimum": 1, "description": "この実装は 1。新しい版は警告して読める所だけ読む" },
    "name": { "type": "string", "minLength": 1, "description": "識別子。.fcpose.json の profile に入る。ファイル名の語幹と同じにする" },
    "description": { "type": "string", "description": "用途・対象モデルのメモ" },
    "standardCurves": {
      "type": "array",
      "items": { "type": "string" },
      "description": "あるべきシェイプ名の一覧（不足チェック用）。名前の照合は大文字小文字を区別する完全一致"
    },
    "mirror": {
      "type": "object",
      "properties": {
        "suffixL": { "type": "string", "description": "左の接尾辞（既定 _L）" },
        "suffixR": { "type": "string", "description": "右の接尾辞（既定 _R）" },
        "exclude": {
          "type": "array",
          "items": { "type": "string" },
          "description": "鏡映の対象外にする名前の部分一致パターン"
        }
      },
      "additionalProperties": true
    },
    "limits": {
      "type": "object",
      "description": "シェイプ名 → 可動域 [最小, 最大]。無いシェイプは 0〜1。誇張は最大 2 まで（R-37）",
      "additionalProperties": {
        "type": "array",
        "items": { "type": "number" },
        "minItems": 2,
        "maxItems": 2
      }
    },
    "lipSync": {
      "type": "object",
      "description": "リップシンクの音素 → シェイプ名（任意。docs/14 §5.8c の「プロファイルから作る」が基本の行を作る）。名前は standardCurves と同じ書き方。順番 = 音素の並び",
      "additionalProperties": {
        "oneOf": [
          { "type": "string", "minLength": 1, "description": "シェイプ 1 つ（重み 1）" },
          { "type": "object", "minProperties": 1, "additionalProperties": { "type": "number" }, "description": "シェイプ名 → 重み（複数）" }
        ]
      }
    },
    "categories": {
      "type": "array",
      "description": "シェイプの分類（任意の上書き。ポーズタブ・セットアップタブのタブ分け）。並び順 = タブの並び。最初に当たった分類に入り、どれにも当たらない名前は「その他」へ。無いときは名前の最初の _ の前で自動に分ける",
      "items": {
        "type": "object",
        "required": ["id"],
        "properties": {
          "id": { "type": "string", "minLength": 1, "description": "分類の識別子（重複しない）" },
          "label": { "type": "string", "description": "タブに出す名前（日本語）" },
          "patterns": {
            "type": "array",
            "items": { "type": "string" },
            "description": "ノード名を除いたターゲット名（bs.eye_close_L → eye_close_L）への規則。prefix:xxx（前方一致）/ contains:xxx（部分一致）/ exact:xxx または接頭辞なし（完全一致）。大文字小文字は区別しない。左右の接尾辞は関係しない"
          }
        },
        "additionalProperties": true
      }
    }
  },
  "additionalProperties": true
}
