{
  "format": "FacialNamingProfile",
  "version": 1,
  "name": "arkit52",
  "description": "ARKit 標準 52 シェイプ（ARFaceAnchor 準拠）。接尾辞は Left / Right。UE 版 FacialNamingProfile の ARKit プリセットと同じ",
  "standardCurves": [
    "eyeBlinkLeft",
    "eyeLookDownLeft",
    "eyeLookInLeft",
    "eyeLookOutLeft",
    "eyeLookUpLeft",
    "eyeSquintLeft",
    "eyeWideLeft",
    "eyeBlinkRight",
    "eyeLookDownRight",
    "eyeLookInRight",
    "eyeLookOutRight",
    "eyeLookUpRight",
    "eyeSquintRight",
    "eyeWideRight",
    "jawForward",
    "jawLeft",
    "jawRight",
    "jawOpen",
    "mouthClose",
    "mouthFunnel",
    "mouthPucker",
    "mouthLeft",
    "mouthRight",
    "mouthSmileLeft",
    "mouthSmileRight",
    "mouthFrownLeft",
    "mouthFrownRight",
    "mouthDimpleLeft",
    "mouthDimpleRight",
    "mouthStretchLeft",
    "mouthStretchRight",
    "mouthRollLower",
    "mouthRollUpper",
    "mouthShrugLower",
    "mouthShrugUpper",
    "mouthPressLeft",
    "mouthPressRight",
    "mouthLowerDownLeft",
    "mouthLowerDownRight",
    "mouthUpperUpLeft",
    "mouthUpperUpRight",
    "browDownLeft",
    "browDownRight",
    "browInnerUp",
    "browOuterUpLeft",
    "browOuterUpRight",
    "cheekPuff",
    "cheekSquintLeft",
    "cheekSquintRight",
    "noseSneerLeft",
    "noseSneerRight",
    "tongueOut"
  ],
  "mirror": {
    "suffixL": "Left",
    "suffixR": "Right",
    "exclude": []
  },
  "limits": {
    "eyeBlinkLeft": [0, 1],
    "eyeLookDownLeft": [0, 1],
    "eyeLookInLeft": [0, 1],
    "eyeLookOutLeft": [0, 1],
    "eyeLookUpLeft": [0, 1],
    "eyeSquintLeft": [0, 1],
    "eyeWideLeft": [0, 1],
    "eyeBlinkRight": [0, 1],
    "eyeLookDownRight": [0, 1],
    "eyeLookInRight": [0, 1],
    "eyeLookOutRight": [0, 1],
    "eyeLookUpRight": [0, 1],
    "eyeSquintRight": [0, 1],
    "eyeWideRight": [0, 1],
    "jawForward": [0, 1],
    "jawLeft": [0, 1],
    "jawRight": [0, 1],
    "jawOpen": [0, 1],
    "mouthClose": [0, 1],
    "mouthFunnel": [0, 1],
    "mouthPucker": [0, 1],
    "mouthLeft": [0, 1],
    "mouthRight": [0, 1],
    "mouthSmileLeft": [0, 1],
    "mouthSmileRight": [0, 1],
    "mouthFrownLeft": [0, 1],
    "mouthFrownRight": [0, 1],
    "mouthDimpleLeft": [0, 1],
    "mouthDimpleRight": [0, 1],
    "mouthStretchLeft": [0, 1],
    "mouthStretchRight": [0, 1],
    "mouthRollLower": [0, 1],
    "mouthRollUpper": [0, 1],
    "mouthShrugLower": [0, 1],
    "mouthShrugUpper": [0, 1],
    "mouthPressLeft": [0, 1],
    "mouthPressRight": [0, 1],
    "mouthLowerDownLeft": [0, 1],
    "mouthLowerDownRight": [0, 1],
    "mouthUpperUpLeft": [0, 1],
    "mouthUpperUpRight": [0, 1],
    "browDownLeft": [0, 1],
    "browDownRight": [0, 1],
    "browInnerUp": [0, 1],
    "browOuterUpLeft": [0, 1],
    "browOuterUpRight": [0, 1],
    "cheekPuff": [0, 1],
    "cheekSquintLeft": [0, 1],
    "cheekSquintRight": [0, 1],
    "noseSneerLeft": [0, 1],
    "noseSneerRight": [0, 1],
    "tongueOut": [0, 1]
  },
  "lipSync": {
    "A": {
      "jawOpen": 0.8,
      "mouthLowerDownLeft": 0.3,
      "mouthLowerDownRight": 0.3
    },
    "I": {
      "jawOpen": 0.2,
      "mouthStretchLeft": 0.6,
      "mouthStretchRight": 0.6,
      "mouthSmileLeft": 0.2,
      "mouthSmileRight": 0.2
    },
    "U": {
      "jawOpen": 0.15,
      "mouthPucker": 0.8,
      "mouthFunnel": 0.3
    },
    "E": {
      "jawOpen": 0.4,
      "mouthStretchLeft": 0.4,
      "mouthStretchRight": 0.4,
      "mouthLowerDownLeft": 0.2,
      "mouthLowerDownRight": 0.2
    },
    "O": {
      "jawOpen": 0.45,
      "mouthFunnel": 0.7,
      "mouthPucker": 0.3
    }
  }
}
