{
  "format": "FacialNamingProfile",
  "version": 1,
  "name": "shizuku",
  "description": "kuromaru9 の shizuku（サンプルモデル）用。顔の blendShape ノード bs のターゲットを bs.<ターゲット名> で並べた（区切り用の __ で始まる 2 件は除く）。名前はモデルの綴りのまま（eye_libUp_L / jaw_forwerd など）。接尾辞は _L / _R",
  "standardCurves": [
    "bs.lipSync_a",
    "bs.lipSync_i",
    "bs.lipSync_u",
    "bs.lipSync_e",
    "bs.lipSync_o",
    "bs.LookingUp",
    "bs.LookingDown",
    "bs.look_left",
    "bs.look_right",
    "bs.look_up",
    "bs.look_down",
    "bs.look_cross",
    "bs.look_shrinkWide",
    "bs.look_shrinkHeight",
    "bs.specular_up",
    "bs.specular_down",
    "bs.specular_big",
    "bs.specular_shrink",
    "bs.specular_shiitake",
    "bs.specular_heart",
    "bs.eye_close_R",
    "bs.eye_close_L",
    "bs.eye_happy_R",
    "bs.eye_happy_L",
    "bs.eye_lidUp_R",
    "bs.eye_libUp_L",
    "bs.eye_wide",
    "bs.eye_jito",
    "bs.eye_pupilShrink",
    "bs.eye_guruguru",
    "bs.eye_zetubou",
    "bs.eye_kuma",
    "bs.brow_happy",
    "bs.brow_innerUp",
    "bs.brow_outerUp_R",
    "bs.brow_outerUp_L",
    "bs.brow_down_R",
    "bs.brow_down_L",
    "bs.brow_down",
    "bs.jaw_open",
    "bs.jaw_forwerd",
    "bs.jaw_left",
    "bs.jaw_right",
    "bs.mouth_i",
    "bs.mouth_neko",
    "bs.mouth_funnel",
    "bs.mouth_pucker",
    "bs.mouth_down",
    "bs.mouth_up",
    "bs.mouth_left",
    "bs.mouth_right",
    "bs.mouth_smile_L",
    "bs.mouth_smile_R",
    "bs.mouth_frown_L",
    "bs.mouth_frown_R",
    "bs.mouth_dimple_L",
    "bs.mouth_dimple_R",
    "bs.mouth_rollUpper",
    "bs.mouth_rollLower",
    "bs.mouth_shrugUpper",
    "bs.mouth_shrugLower",
    "bs.mouth_upperUp_L",
    "bs.mouth_upperUp_R",
    "bs.mouth_lowerDown_L",
    "bs.mouth_lowerDown_R",
    "bs.mouth_close",
    "bs.mouth_tongueOut",
    "bs.cheek_puff",
    "bs.cheek_red",
    "bs.cheek_redNose",
    "bs.other_tears",
    "bs.other_ase_forehead",
    "bs.other_ase_cheek",
    "bs.other_ase_jaw",
    "bs.other_aozame"
  ],
  "mirror": {
    "suffixL": "_L",
    "suffixR": "_R",
    "exclude": []
  },
  "limits": {
    "bs.lipSync_a": [0, 1],
    "bs.lipSync_i": [0, 1],
    "bs.lipSync_u": [0, 1],
    "bs.lipSync_e": [0, 1],
    "bs.lipSync_o": [0, 1],
    "bs.LookingUp": [0, 1],
    "bs.LookingDown": [0, 1],
    "bs.look_left": [0, 1],
    "bs.look_right": [0, 1],
    "bs.look_up": [0, 1],
    "bs.look_down": [0, 1],
    "bs.look_cross": [0, 1],
    "bs.look_shrinkWide": [0, 1],
    "bs.look_shrinkHeight": [0, 1],
    "bs.specular_up": [0, 1],
    "bs.specular_down": [0, 1],
    "bs.specular_big": [0, 1],
    "bs.specular_shrink": [0, 1],
    "bs.specular_shiitake": [0, 1],
    "bs.specular_heart": [0, 1],
    "bs.eye_close_R": [0, 1],
    "bs.eye_close_L": [0, 1],
    "bs.eye_happy_R": [0, 1],
    "bs.eye_happy_L": [0, 1],
    "bs.eye_lidUp_R": [0, 1],
    "bs.eye_libUp_L": [0, 1],
    "bs.eye_wide": [0, 1],
    "bs.eye_jito": [0, 1],
    "bs.eye_pupilShrink": [0, 1],
    "bs.eye_guruguru": [0, 1],
    "bs.eye_zetubou": [0, 1],
    "bs.eye_kuma": [0, 1],
    "bs.brow_happy": [0, 1],
    "bs.brow_innerUp": [0, 1],
    "bs.brow_outerUp_R": [0, 1],
    "bs.brow_outerUp_L": [0, 1],
    "bs.brow_down_R": [0, 1],
    "bs.brow_down_L": [0, 1],
    "bs.brow_down": [0, 1],
    "bs.jaw_open": [0, 1],
    "bs.jaw_forwerd": [0, 1],
    "bs.jaw_left": [0, 1],
    "bs.jaw_right": [0, 1],
    "bs.mouth_i": [0, 1],
    "bs.mouth_neko": [0, 1],
    "bs.mouth_funnel": [0, 1],
    "bs.mouth_pucker": [0, 1],
    "bs.mouth_down": [0, 1],
    "bs.mouth_up": [0, 1],
    "bs.mouth_left": [0, 1],
    "bs.mouth_right": [0, 1],
    "bs.mouth_smile_L": [0, 1],
    "bs.mouth_smile_R": [0, 1],
    "bs.mouth_frown_L": [0, 1],
    "bs.mouth_frown_R": [0, 1],
    "bs.mouth_dimple_L": [0, 1],
    "bs.mouth_dimple_R": [0, 1],
    "bs.mouth_rollUpper": [0, 1],
    "bs.mouth_rollLower": [0, 1],
    "bs.mouth_shrugUpper": [0, 1],
    "bs.mouth_shrugLower": [0, 1],
    "bs.mouth_upperUp_L": [0, 1],
    "bs.mouth_upperUp_R": [0, 1],
    "bs.mouth_lowerDown_L": [0, 1],
    "bs.mouth_lowerDown_R": [0, 1],
    "bs.mouth_close": [0, 1],
    "bs.mouth_tongueOut": [0, 1],
    "bs.cheek_puff": [0, 1],
    "bs.cheek_red": [0, 1],
    "bs.cheek_redNose": [0, 1],
    "bs.other_tears": [0, 1],
    "bs.other_ase_forehead": [0, 1],
    "bs.other_ase_cheek": [0, 1],
    "bs.other_ase_jaw": [0, 1],
    "bs.other_aozame": [0, 1]
  }
}
