{
  "format": "FacialNamingProfile",
  "version": 1,
  "name": "metahuman",
  "description": "MetaHuman（RigLogic の制御カーブ CTRL_expressions_*）。カーブは約 250 本あるため一覧は同梱しない（対象メッシュから列挙して standardCurves へ追記すること）。接尾辞は L / R（末尾一致のため誤検出に注意）。UE 版のプリセットと同じ",
  "standardCurves": [],
  "mirror": {
    "suffixL": "L",
    "suffixR": "R",
    "exclude": []
  },
  "limits": {},
  "categories": [
    {
      "id": "eye",
      "label": "目",
      "patterns": [
        "prefix:CTRL_expressions_eye"
      ]
    },
    {
      "id": "brow",
      "label": "眉",
      "patterns": [
        "prefix:CTRL_expressions_brow"
      ]
    },
    {
      "id": "nose",
      "label": "鼻",
      "patterns": [
        "prefix:CTRL_expressions_nose"
      ]
    },
    {
      "id": "cheek",
      "label": "頬",
      "patterns": [
        "prefix:CTRL_expressions_cheek"
      ]
    },
    {
      "id": "mouth",
      "label": "口",
      "patterns": [
        "prefix:CTRL_expressions_mouth",
        "prefix:CTRL_expressions_lip"
      ]
    },
    {
      "id": "jaw",
      "label": "あご",
      "patterns": [
        "prefix:CTRL_expressions_jaw"
      ]
    },
    {
      "id": "tongue",
      "label": "舌",
      "patterns": [
        "prefix:CTRL_expressions_tongue"
      ]
    },
    {
      "id": "neck",
      "label": "首",
      "patterns": [
        "prefix:CTRL_expressions_neck"
      ]
    }
  ]
}
